Name,Stars⭐,Last Updated,First Commit,URL,Forks,Issues,Language,License,Description,Topics
llemonstack,60,2025-05-01,2025-03-03,https://github.com/LLemonStack/llemonstack,14,0,TypeScript,GNU Affero General Public License v3.0,"All-in-one local low-code AI agent development platform. Installs and runs n8n, Flowise, Browser-Use, Qdrant, Ollama, and more. Proxies LLM requests through LiteLLM with Langfuse for observability.",
drivers,59,2024-07-23,2020-09-20,https://github.com/jupyter-naas/drivers,13,5,Python,GNU Affero General Public License v3.0,"Low-code Python library enabling access to APIs, tools, data sources in seconds.","connectors,data,data-analysis,data-collection,data-engineering,data-integration,data-mesh,data-science,elt,etl,hacktoberfest,hacktoberfest2022,integration,lowcode,open-source,opensource,pipeline,pipelines,python"
jvs,59,2025-06-05,2022-07-26,https://github.com/RKQF-JVS/jvs,23,0,Java,Other,"JVS是采用 Spring Cloud+VUE+Demo集的技术普惠型微服务开源框架,面向中小型软件开发团队，可以快速实现应用开发与发布，框架提供丰富的基础功能，集成众多业务引擎，它灵活性强，界面化配置对开发者友好，底层容器化构建，集合持续化构建。","java,javascript,jvs,low-code,springcloud,vue"
basemulti,57,2025-01-11,2024-11-14,https://github.com/basemulti/basemulti,6,0,TypeScript,GNU Affero General Public License v3.0,✨ The Next-Gen No-Code Database Platform. Transform any database into a powerful Airtable-like interface and instant API.,"airtable-alternative,app-builder,backend,database,headless-cms,low-code,mysql,no-code,postgresql,self-hosted,spreadsheet,sqlite,typescript"
Diff-Retinex,56,2024-12-30,2024-08-22,https://github.com/XunpengYi/Diff-Retinex,3,3,Python,MIT License,Official Code of the Diff-Retinex: Rethinking Low-light Image Enhancement with A Generative Diffusion Model (ICCV2023),
oinone-kunlun,56,2025-06-05,2025-05-16,https://github.com/oinone/oinone-kunlun,1,0,TypeScript,GNU Affero General Public License v3.0,No description,"ai-lowcode,framework,low-code,low-code-framework,lowcode,oinone"
Trick,56,2025-03-14,2020-03-11,https://github.com/YiiGaa/Trick,11,0,JavaScript,Apache License 2.0,A front-end web page low-code framework,
limbas,55,2025-02-18,2013-05-16,https://github.com/limbas/limbas,9,2,PHP,GNU General Public License v2.0,Low-code database framework that fits your needs,"appliance,cms,crm,database-gui,database-management,dms,erp,form-generator,php,product-catalog,report-generator,user-group-management,workflow,workflow-engine"
xgen,55,2025-05-18,2022-03-01,https://github.com/YaoApp/xgen,32,2,TypeScript,Apache License 2.0,A official lowcode resolution based yao app engine.,"ant-design,components,design-system,low-code,mobx,react,shadow-dom,typescript,umi"
LowMemoryFHEResNet20,54,2025-03-04,2023-10-24,https://github.com/narger-ef/LowMemoryFHEResNet20,16,1,Jupyter Notebook,MIT License,"Source code for the paper ""Encrypted Image Classification with Low Memory Footprint using Fully Homomorphic Encryption""","convolutional-neural-network,fhe,homomorphic-encryption,privacy-preserving,resnet,secure-computation"
dex,54,2025-03-27,2022-06-01,https://github.com/appsource/dex,403,1,JavaScript,GNU General Public License v3.0,"DEX White-label at your own domain without coding skills. 1 min installation, JUST FROK AND ADD DOMAIN","binance,bsc,clone,dex,ethereum,evm,exchange,exchnage,fork,low-code,low-code-framework,uniswap,uniswap-v2"
tachybase,54,2025-06-05,2024-10-15,https://github.com/tachybase/tachybase,16,30,TypeScript,Apache License 2.0,"Tachybase is a pluggable application framework., where developers can build complex application logic, while core developers focus on ensuring the stability of key modules and adapting to different en","admin-dashboard,approval,crm,crud,erp,internal-tools,low-code,low-code-development,low-code-development-platform,low-code-platform,nodejs,self-hosted,workflows"
CoCreate-admin,53,2025-05-01,2019-06-29,https://github.com/CoCreate-app/CoCreate-admin,19,1,HTML,MIT License,"A No Code Admin, CRM, CMS, Website Builder platform. Powered by CoCreateJS to provide Realtime and Collaborative CRUD functionality. ","admin,cms,cocreate,cocreate-framework,cocreatejs,cocreatejs-component,collaboration,collaborative-framework,crm,html5-framework,javascript-framework,low-code,low-code-framework,no-code,no-code-framework,realtime,realtime-framework,shared-editing"
quark-ui,51,2025-04-02,2020-02-10,https://github.com/quarkcloudio/quark-ui,16,0,JavaScript,No license,QuarkUI is a low code engine that can configure and combine rich front-end pages through JSON.,
BESSER-Agentic-Framework,51,2025-04-08,2023-07-04,https://github.com/BESSER-PEARL/BESSER-Agentic-Framework,7,38,Python,MIT License,"Design and implement agents, bot and chatbots in Python","agent,bot,chatbot,framework,low-code,nlp,python"
Fierro,50,2025-06-02,2021-07-09,https://github.com/lanl/Fierro,22,21,C++,"BSD 3-Clause ""New"" or ""Revised"" License","Fierro is a C++ code designed to aid the research and development of numerical methods, testing of user-specified models, and creating multi-scale models related to quasi-static solid mechanics and co","computational-mechanics,crystal-plasticity,engineering,finite-element-methods,lagrangian,lagrangian-mechanics,material-science,micromechanics,parallel-computing,shock-capturing,solid-dynamics,topology-optimization"
